{
  "canonical_query_sha256": "38592c2a6b4b9f60324f11ca58c7e1864609bf40fa650623d9fcb9827ae53227",
  "dataset_view_sha256": "bb0e9f3ed47a65eabbaab4e0a4de192ca7918a61eee111e273a70e145f87692b",
  "decision_sha256": "36132e7df2234e0dd9083de9602a48a84bc5b29a7ede27f2bbb0a3279d634471",
  "duration_ms": 372,
  "iteration": 0,
  "partition_receipts_path": "artifacts/reproductions/20261015T135745Z/cases/MR05-b009-s155921/attempt-001/followup/runs/20261015T152644Z-ec4a6ac0d4/tools/iteration-0/region_stats.partitions.json",
  "plan_sha256": "e7f87d9dd5ece42ff3174af984b16f8d038346391845b23069a01c979b33e56a",
  "receipt_id": "20261015T152644Z-ec4a6ac0d4.0.region_stats",
  "result_path": "artifacts/reproductions/20261015T135745Z/cases/MR05-b009-s155921/attempt-001/followup/runs/20261015T152644Z-ec4a6ac0d4/tools/iteration-0/region_stats.result.json",
  "result_sha256": "e9bd57395633c64f639da2106e332b01dced12bb9b1eecb9ff20f988e6ca8ea6",
  "run_id": "20261015T152644Z-ec4a6ac0d4",
  "scan_complete": true,
  "schema_version": "1.0",
  "selection_sha256": "112fba6cadad966b088746693f8766b487e7756b8d409db0df1ab578f16f30da",
  "source_snapshot_complete": true,
  "strategy": "indexed",
  "tool": "region_stats",
  "tool_version": "1.0",
  "unavailable_lookback_months": [
    "2024-07",
    "2024-08",
    "2024-09"
  ],
  "visible_months": [
    "2025-07",
    "2025-08",
    "2025-09",
    "2025-10",
    "2025-11",
    "2025-12",
    "2026-01",
    "2026-02",
    "2026-03",
    "2026-04",
    "2026-05",
    "2026-06"
  ]
}
