{
  "canonical_query_sha256": "372686b20d12d40c7d761bf5236743093b881ddbb15a4882d8ccd1b37e1cae8e",
  "dataset_view_sha256": "bb0e9f3ed47a65eabbaab4e0a4de192ca7918a61eee111e273a70e145f87692b",
  "decision_sha256": "edb3bfd5b5ce3f82b0abb93d5052890d0180e6c2520e4fb1df855367d33fde32",
  "duration_ms": 181,
  "iteration": 0,
  "partition_receipts_path": "artifacts/reproductions/20261015T135745Z/cases/MR06-b019-s130363/attempt-001/followup/runs/20261015T153353Z-67f15fa775/tools/iteration-0/region_stats.partitions.json",
  "plan_sha256": "5ef8b5e4796e680d84cc672a54ef0844628e584c8b1bd3e0beacd5d52f24ffb6",
  "receipt_id": "20261015T153353Z-67f15fa775.0.region_stats",
  "result_path": "artifacts/reproductions/20261015T135745Z/cases/MR06-b019-s130363/attempt-001/followup/runs/20261015T153353Z-67f15fa775/tools/iteration-0/region_stats.result.json",
  "result_sha256": "b9e63336abfc7defd9e121d8a58fc9dc0c119be4f4a244940457abd29b367f2f",
  "run_id": "20261015T153353Z-67f15fa775",
  "scan_complete": true,
  "schema_version": "1.0",
  "selection_sha256": "a685848c3c8289187718060580edaf09bb493b84c3e1d4f45c8884bea7dd0a78",
  "source_snapshot_complete": true,
  "strategy": "indexed",
  "tool": "region_stats",
  "tool_version": "1.0",
  "unavailable_lookback_months": [
    "2024-08",
    "2024-09"
  ],
  "visible_months": [
    "2025-08",
    "2025-09",
    "2025-10",
    "2025-11",
    "2025-12",
    "2026-01",
    "2026-02",
    "2026-03",
    "2026-04",
    "2026-05",
    "2026-06",
    "2026-07"
  ]
}
