{
  "canonical_query_sha256": "2541679b5e070fe2df115590a07ae7345ea708d1c98dde287bc11b431a3e78ef",
  "dataset_view_sha256": "6a35991fd95e850f077ff21cb6315f8ffa109845434b4a87128c546897b16f4d",
  "decision_sha256": "eef637eaa8fe9902ae7a972a29e7c2acfa60bb0393270a370a666134ead22bf8",
  "duration_ms": 3081,
  "iteration": 0,
  "partition_receipts_path": "artifacts/campaigns/headline-live-v1/cases/MR01-b023-s130363/attempt-001/followup/runs/20261003T191908Z-d0051666ef/tools/iteration-0/supply_stats.partitions.json",
  "plan_sha256": "fc4f1fcef4cae73bbbc0ecf6dabe5244e37f2f4f7d7c9650bf017dd06732c829",
  "receipt_id": "20261003T191908Z-d0051666ef.0.supply_stats",
  "result_path": "artifacts/campaigns/headline-live-v1/cases/MR01-b023-s130363/attempt-001/followup/runs/20261003T191908Z-d0051666ef/tools/iteration-0/supply_stats.result.json",
  "result_sha256": "38ccf45ca8533dc62fefc7dfc6562f36330aa5411c225d8a16a1b8b56e8e0bdf",
  "run_id": "20261003T191908Z-d0051666ef",
  "scan_complete": true,
  "schema_version": "1.0",
  "selection_sha256": "cb78aeff528c76588b3895a81dfb1fe5cd10d7e570ce03a29c8f83cf4d89fe0a",
  "source_snapshot_complete": true,
  "strategy": "indexed",
  "tool": "supply_stats",
  "tool_version": "1.0",
  "unavailable_lookback_months": [
    "2024-09"
  ],
  "visible_months": [
    "2025-09",
    "2025-10",
    "2025-11",
    "2025-12",
    "2026-01",
    "2026-02",
    "2026-03",
    "2026-04",
    "2026-05",
    "2026-06",
    "2026-07",
    "2026-08"
  ]
}
