{
  "canonical_query_sha256": "aca0bd212f5c80930e283cce92630d1e92e96dcc7038a9e0176c71c35ca43858",
  "dataset_view_sha256": "bb0e9f3ed47a65eabbaab4e0a4de192ca7918a61eee111e273a70e145f87692b",
  "decision_sha256": "eef637eaa8fe9902ae7a972a29e7c2acfa60bb0393270a370a666134ead22bf8",
  "duration_ms": 11,
  "iteration": 0,
  "partition_receipts_path": "artifacts/reproductions/20261015T135745Z/cases/MR07-b020-s155921/attempt-001/followup/runs/20261015T153801Z-1bc5bec30a/tools/iteration-0/supply_stats.partitions.json",
  "plan_sha256": "a583b491d5842d7ea2fe251b1dd9807052f4a32b1d6d5a0e0574f9f7d4382c41",
  "receipt_id": "20261015T153801Z-1bc5bec30a.0.supply_stats",
  "result_path": "artifacts/reproductions/20261015T135745Z/cases/MR07-b020-s155921/attempt-001/followup/runs/20261015T153801Z-1bc5bec30a/tools/iteration-0/supply_stats.result.json",
  "result_sha256": "e9f6d357750fb28a5d6c442622fc82631056296cb95d98f96e32e5d90dd9018f",
  "run_id": "20261015T153801Z-1bc5bec30a",
  "scan_complete": true,
  "schema_version": "1.0",
  "selection_sha256": "83809e4350b9ff1632d4efe84c4c5088d4c81a174d9fd28c19c2e4b1b74e08a7",
  "source_snapshot_complete": true,
  "strategy": "indexed",
  "tool": "supply_stats",
  "tool_version": "1.0",
  "unavailable_lookback_months": [
    "2024-09"
  ],
  "visible_months": [
    "2025-09",
    "2025-10",
    "2025-11",
    "2025-12",
    "2026-01",
    "2026-02",
    "2026-03",
    "2026-04",
    "2026-05",
    "2026-06",
    "2026-07",
    "2026-08"
  ]
}
