{
  "canonical_query_sha256": "918d9af7dedd19692d8b433ee89e94fa5a9dbe80bc6eb11d011fe73df1edcc33",
  "dataset_view_sha256": "f5ab00837e56d6499d3829774d99f82aa959b03a60be3e14ff195469048c7d75",
  "decision_sha256": "e21ad0bd656fe99187f52bc568d37989abf68bc3488b8ac5ba94892eb249992f",
  "duration_ms": 147,
  "iteration": 0,
  "partition_receipts_path": "artifacts/campaigns/headline-live-v1/cases/MR02-b030-s130363/attempt-001/followup/runs/20261004T214519Z-64c003ff4a/tools/iteration-0/price_stats.partitions.json",
  "plan_sha256": "bd7b92cf4706c9ffcea78d286b717e52835778d24c80c60eaebba5019ccb4325",
  "receipt_id": "20261004T214519Z-64c003ff4a.0.price_stats",
  "result_path": "artifacts/campaigns/headline-live-v1/cases/MR02-b030-s130363/attempt-001/followup/runs/20261004T214519Z-64c003ff4a/tools/iteration-0/price_stats.result.json",
  "result_sha256": "424360687acceaf888a478c23163d846bee95341f5477c76e909f54c50872c12",
  "run_id": "20261004T214519Z-64c003ff4a",
  "scan_complete": true,
  "schema_version": "1.0",
  "selection_sha256": "0757715a5e068a2efdd63816b17ab7312c80d5ecafb675de9baeeed0f35db971",
  "source_snapshot_complete": true,
  "strategy": "indexed",
  "tool": "price_stats",
  "tool_version": "1.0",
  "unavailable_lookback_months": [
    "2024-09"
  ],
  "visible_months": [
    "2025-09",
    "2025-10",
    "2025-11",
    "2025-12",
    "2026-01",
    "2026-02",
    "2026-03",
    "2026-04",
    "2026-05",
    "2026-06",
    "2026-07",
    "2026-08"
  ]
}
