{
  "canonical_query_sha256": "c191f19b5a6c7dc28dfdce86d36a1aa56258a42ec4e525b4c87b91727f86073f",
  "dataset_view_sha256": "c5a236793a933b59073e3531f3863a5502892d8db24aa127a4e2fc7fe35bc902",
  "decision_sha256": "faa8f49b2adfca21c3f16f00da88e9e39149bbcc36f48adaf10fb3feb83ad6e9",
  "duration_ms": 34,
  "iteration": 1,
  "partition_receipts_path": "artifacts/campaigns/headline-live-v1/cases/MR10-b020-s104729/attempt-001/followup/runs/20261014T133810Z-4b5b5c8a5e/tools/iteration-1/region_stats.partitions.json",
  "plan_sha256": "52d707353ef9186d3c6669ae2998956f7178116ad663ff2809959095766be4b9",
  "receipt_id": "20261014T133810Z-4b5b5c8a5e.1.region_stats",
  "result_path": "artifacts/campaigns/headline-live-v1/cases/MR10-b020-s104729/attempt-001/followup/runs/20261014T133810Z-4b5b5c8a5e/tools/iteration-1/region_stats.result.json",
  "result_sha256": "e64b06acf41df8d2377cb1a9c98c05629f69b217966ee4b8ba7d1f01bb2a174d",
  "run_id": "20261014T133810Z-4b5b5c8a5e",
  "scan_complete": true,
  "schema_version": "1.0",
  "selection_sha256": "83809e4350b9ff1632d4efe84c4c5088d4c81a174d9fd28c19c2e4b1b74e08a7",
  "source_snapshot_complete": true,
  "strategy": "full_csv",
  "tool": "region_stats",
  "tool_version": "1.0",
  "unavailable_lookback_months": [
    "2024-08",
    "2024-09"
  ],
  "visible_months": [
    "2025-08",
    "2025-09",
    "2025-10",
    "2025-11",
    "2025-12",
    "2026-01",
    "2026-02",
    "2026-03",
    "2026-04",
    "2026-05",
    "2026-06",
    "2026-07"
  ]
}
