{
  "canonical_query_sha256": "7217598e40be8b3efdf0925428a466845ba6d956878f7621bc1c6a28bce52ea9",
  "dataset_view_sha256": "bb0e9f3ed47a65eabbaab4e0a4de192ca7918a61eee111e273a70e145f87692b",
  "decision_sha256": "eef637eaa8fe9902ae7a972a29e7c2acfa60bb0393270a370a666134ead22bf8",
  "duration_ms": 621,
  "iteration": 0,
  "partition_receipts_path": "artifacts/campaigns/headline-live-v1/cases/MR07-b027-s104729/attempt-001/followup/runs/20261009T181735Z-5b947d5737/tools/iteration-0/supply_stats.partitions.json",
  "plan_sha256": "bc4a77c89bd4a56e6ebe944486186ccf5df400e1b7ed242cf2d8c84dfc0f1ce8",
  "receipt_id": "20261009T181735Z-5b947d5737.0.supply_stats",
  "result_path": "artifacts/campaigns/headline-live-v1/cases/MR07-b027-s104729/attempt-001/followup/runs/20261009T181735Z-5b947d5737/tools/iteration-0/supply_stats.result.json",
  "result_sha256": "ccc32f5e765a2eeca8ce5b19e3a2c6185273395816b141c9caf12c5442e6a06b",
  "run_id": "20261009T181735Z-5b947d5737",
  "scan_complete": true,
  "schema_version": "1.0",
  "selection_sha256": "781bb252c7fb291c92d3bbb6d7e5c3e9f0dc802f3fbd96b07cbc4a7f68856dc7",
  "source_snapshot_complete": true,
  "strategy": "indexed",
  "tool": "supply_stats",
  "tool_version": "1.0",
  "unavailable_lookback_months": [],
  "visible_months": [
    "2025-10",
    "2025-11",
    "2025-12",
    "2026-01",
    "2026-02",
    "2026-03",
    "2026-04",
    "2026-05",
    "2026-06",
    "2026-07",
    "2026-08",
    "2026-09"
  ]
}
