{
  "canonical_query_sha256": "6dcad3ef062b012e16147c728122155a7a5aa178694b3efb31abf891ca8a4552",
  "dataset_view_sha256": "bb0e9f3ed47a65eabbaab4e0a4de192ca7918a61eee111e273a70e145f87692b",
  "decision_sha256": "e21ad0bd656fe99187f52bc568d37989abf68bc3488b8ac5ba94892eb249992f",
  "duration_ms": 124,
  "iteration": 0,
  "partition_receipts_path": "artifacts/campaigns/headline-live-v1/cases/MR05-b003-s130363/attempt-001/followup/runs/20261006T104000Z-a125bc8f2c/tools/iteration-0/price_stats.partitions.json",
  "plan_sha256": "d35fef9f7751879dc5093dfd93618ed116559ea85c9dd9b8567d5575e5953c61",
  "receipt_id": "20261006T104000Z-a125bc8f2c.0.price_stats",
  "result_path": "artifacts/campaigns/headline-live-v1/cases/MR05-b003-s130363/attempt-001/followup/runs/20261006T104000Z-a125bc8f2c/tools/iteration-0/price_stats.result.json",
  "result_sha256": "0fb6ed1962816bb9554de9df67497e478b53c020e12cf7a571c0a416eed152b9",
  "run_id": "20261006T104000Z-a125bc8f2c",
  "scan_complete": true,
  "schema_version": "1.0",
  "selection_sha256": "2bff92ff7587a4b17834d1c1b61987e9ed5692b6be7cb32bf74b2473b4ebc412",
  "source_snapshot_complete": true,
  "strategy": "indexed",
  "tool": "price_stats",
  "tool_version": "1.0",
  "unavailable_lookback_months": [
    "2024-07",
    "2024-08",
    "2024-09"
  ],
  "visible_months": [
    "2025-07",
    "2025-08",
    "2025-09",
    "2025-10",
    "2025-11",
    "2025-12",
    "2026-01",
    "2026-02",
    "2026-03",
    "2026-04",
    "2026-05",
    "2026-06"
  ]
}
