{
  "canonical_query_sha256": "15ecc4ae6302855d7bd9e25e8e73830e563782681c6f928430db1a1d6a0a18e3",
  "dataset_view_sha256": "bb0e9f3ed47a65eabbaab4e0a4de192ca7918a61eee111e273a70e145f87692b",
  "decision_sha256": "e21ad0bd656fe99187f52bc568d37989abf68bc3488b8ac5ba94892eb249992f",
  "duration_ms": 124,
  "iteration": 0,
  "partition_receipts_path": "artifacts/reproductions/20261015T135745Z/cases/MR07-b029-s104729/attempt-001/followup/runs/20261015T153909Z-bbaacf00cf/tools/iteration-0/price_stats.partitions.json",
  "plan_sha256": "7e3ee54e0437af5df614dc5d97d496ccbf7b7f0023466fc57de8384f6aa6f065",
  "receipt_id": "20261015T153909Z-bbaacf00cf.0.price_stats",
  "result_path": "artifacts/reproductions/20261015T135745Z/cases/MR07-b029-s104729/attempt-001/followup/runs/20261015T153909Z-bbaacf00cf/tools/iteration-0/price_stats.result.json",
  "result_sha256": "b4807028c1e618df04f226c31c430d697ca8608fcbe5bf2a3d6a44f5c450dca6",
  "run_id": "20261015T153909Z-bbaacf00cf",
  "scan_complete": true,
  "schema_version": "1.0",
  "selection_sha256": "67a5815cec4f4fefb20d77890c1eb0087f6f81adccb838f3a064fbfdfc340524",
  "source_snapshot_complete": true,
  "strategy": "indexed",
  "tool": "price_stats",
  "tool_version": "1.0",
  "unavailable_lookback_months": [],
  "visible_months": [
    "2025-10",
    "2025-11",
    "2025-12",
    "2026-01",
    "2026-02",
    "2026-03",
    "2026-04",
    "2026-05",
    "2026-06",
    "2026-07",
    "2026-08",
    "2026-09"
  ]
}
