{
  "canonical_query_sha256": "d734498dd6bb7f54091430a3498a16bc27c94f355303142a74864c6820d030ca",
  "dataset_view_sha256": "bb0e9f3ed47a65eabbaab4e0a4de192ca7918a61eee111e273a70e145f87692b",
  "decision_sha256": "eef637eaa8fe9902ae7a972a29e7c2acfa60bb0393270a370a666134ead22bf8",
  "duration_ms": 124,
  "iteration": 0,
  "partition_receipts_path": "artifacts/campaigns/headline-live-v1/cases/MR07-b015-s130363/attempt-001/followup/runs/20261009T073232Z-b3366729fc/tools/iteration-0/supply_stats.partitions.json",
  "plan_sha256": "e112569b88d946ee72d71cbb0522237cf4e4a014b741f88645a6fee3582c032d",
  "receipt_id": "20261009T073232Z-b3366729fc.0.supply_stats",
  "result_path": "artifacts/campaigns/headline-live-v1/cases/MR07-b015-s130363/attempt-001/followup/runs/20261009T073232Z-b3366729fc/tools/iteration-0/supply_stats.result.json",
  "result_sha256": "225f6f07759e74f98a4971d203b0283d033d840b3c46e2762c5325d02e1d492e",
  "run_id": "20261009T073232Z-b3366729fc",
  "scan_complete": true,
  "schema_version": "1.0",
  "selection_sha256": "52fd182d2ca24ac008592b4ace668d34253f33583a91ab5e633c8a806a935d60",
  "source_snapshot_complete": true,
  "strategy": "indexed",
  "tool": "supply_stats",
  "tool_version": "1.0",
  "unavailable_lookback_months": [
    "2024-09"
  ],
  "visible_months": [
    "2025-09",
    "2025-10",
    "2025-11",
    "2025-12",
    "2026-01",
    "2026-02",
    "2026-03",
    "2026-04",
    "2026-05",
    "2026-06",
    "2026-07",
    "2026-08"
  ]
}
