{
  "canonical_query_sha256": "9f639c924aeaf2161bb1e2333ec7f16e38b6fd79da7e39545abf605488e1f7bc",
  "dataset_view_sha256": "aac3365894f7e643e5535983ac2e2cd88bbe5210a4f4b812710b0cf483ce3f1b",
  "decision_sha256": "eef637eaa8fe9902ae7a972a29e7c2acfa60bb0393270a370a666134ead22bf8",
  "duration_ms": 11,
  "iteration": 0,
  "partition_receipts_path": "artifacts/reproductions/20261015T135745Z/cases/MR09-b014-s130363/attempt-001/followup/runs/20261015T160904Z-0de006d126/tools/iteration-0/supply_stats.partitions.json",
  "plan_sha256": "e61cb378dd52f3e5efd02d4e43f93d02eae9b40db62c6860267a01916d6628a1",
  "receipt_id": "20261015T160904Z-0de006d126.0.supply_stats",
  "result_path": "artifacts/reproductions/20261015T135745Z/cases/MR09-b014-s130363/attempt-001/followup/runs/20261015T160904Z-0de006d126/tools/iteration-0/supply_stats.result.json",
  "result_sha256": "5172e80a1dfd62eacd383ff556db157f3ebd28d6e28f6f9bcf9b4350a3de102b",
  "run_id": "20261015T160904Z-0de006d126",
  "scan_complete": true,
  "schema_version": "1.0",
  "selection_sha256": "3cbe5d2e894f31b9c839e72162cd73a4484327b3afa3bcd26e962c2b8ae2bfb7",
  "source_snapshot_complete": true,
  "strategy": "indexed",
  "tool": "supply_stats",
  "tool_version": "1.0",
  "unavailable_lookback_months": [
    "2024-08",
    "2024-09"
  ],
  "visible_months": [
    "2025-08",
    "2025-09",
    "2025-10",
    "2025-11",
    "2025-12",
    "2026-01",
    "2026-02",
    "2026-03",
    "2026-04",
    "2026-05",
    "2026-06",
    "2026-07"
  ]
}
