{
  "canonical_query_sha256": "c261d1fc675e302928a9d857ce837b2fb6b3f32b19acc0671f84cb2873976668",
  "dataset_view_sha256": "0a11b34903144216e4e7824e8c0395f55aad6d76727b5425728d41abe0b89420",
  "decision_sha256": "edb3bfd5b5ce3f82b0abb93d5052890d0180e6c2520e4fb1df855367d33fde32",
  "duration_ms": 1670,
  "iteration": 0,
  "partition_receipts_path": "artifacts/campaigns/headline-live-v1/cases/MR08-b001-s155921/attempt-001/followup/runs/20261010T020956Z-69ccaa5ecc/tools/iteration-0/region_stats.partitions.json",
  "plan_sha256": "eb564c92dd855c68cce84aa08e809c9ab10cb7e459c5ca74d2a50d45870bcaf1",
  "receipt_id": "20261010T020956Z-69ccaa5ecc.0.region_stats",
  "result_path": "artifacts/campaigns/headline-live-v1/cases/MR08-b001-s155921/attempt-001/followup/runs/20261010T020956Z-69ccaa5ecc/tools/iteration-0/region_stats.result.json",
  "result_sha256": "bd41a9f342b872895b86589c7b77a2cd6e0d7f9fec5c021fa0663922fd2d7250",
  "run_id": "20261010T020956Z-69ccaa5ecc",
  "scan_complete": true,
  "schema_version": "1.0",
  "selection_sha256": "e9165ef1c051c811b0ec9f2c48af40a794a06057cc0df3a637fd9b9a9506fbf6",
  "source_snapshot_complete": true,
  "strategy": "indexed",
  "tool": "region_stats",
  "tool_version": "1.0",
  "unavailable_lookback_months": [
    "2024-07",
    "2024-08",
    "2024-09"
  ],
  "visible_months": [
    "2025-07",
    "2025-08",
    "2025-09",
    "2025-10",
    "2025-11",
    "2025-12",
    "2026-01",
    "2026-02",
    "2026-03",
    "2026-04",
    "2026-05",
    "2026-06"
  ]
}
