{
  "canonical_query_sha256": "abee114c92cfdcf08b8406d361046b829cae392b39ee584d7226af0628afdf34",
  "dataset_view_sha256": "bb0e9f3ed47a65eabbaab4e0a4de192ca7918a61eee111e273a70e145f87692b",
  "decision_sha256": "eef637eaa8fe9902ae7a972a29e7c2acfa60bb0393270a370a666134ead22bf8",
  "duration_ms": 23,
  "iteration": 0,
  "partition_receipts_path": "artifacts/reproductions/20261015T135745Z/cases/MR05-b021-s130363/attempt-001/source/runs/20261015T152933Z-08c509456c/tools/iteration-0/supply_stats.partitions.json",
  "plan_sha256": "9b160ceadf84b0751058eb7d00f668277826ff691fd2bccf6cbeb3a52e453750",
  "receipt_id": "20261015T152933Z-08c509456c.0.supply_stats",
  "result_path": "artifacts/reproductions/20261015T135745Z/cases/MR05-b021-s130363/attempt-001/source/runs/20261015T152933Z-08c509456c/tools/iteration-0/supply_stats.result.json",
  "result_sha256": "588f51e754fd25c4c234c6617aacf5f5c0b13772e090ee106f5ba66d4a08b561",
  "run_id": "20261015T152933Z-08c509456c",
  "scan_complete": true,
  "schema_version": "1.0",
  "selection_sha256": "df24643dedbb4621da2476b538de1614b1dc79960df7e59dc91a44468aeafcde",
  "source_snapshot_complete": true,
  "strategy": "indexed",
  "tool": "supply_stats",
  "tool_version": "1.0",
  "unavailable_lookback_months": [
    "2024-09"
  ],
  "visible_months": [
    "2025-09",
    "2025-10",
    "2025-11",
    "2025-12",
    "2026-01",
    "2026-02",
    "2026-03",
    "2026-04",
    "2026-05",
    "2026-06",
    "2026-07",
    "2026-08"
  ]
}
