{
  "canonical_query_sha256": "fa7746a53050fa1b5c795a22ca6b11edfb1c4ce4338d073ec953efa2adbc17b3",
  "dataset_view_sha256": "bb0e9f3ed47a65eabbaab4e0a4de192ca7918a61eee111e273a70e145f87692b",
  "decision_sha256": "e21ad0bd656fe99187f52bc568d37989abf68bc3488b8ac5ba94892eb249992f",
  "duration_ms": 271,
  "iteration": 0,
  "partition_receipts_path": "artifacts/campaigns/headline-live-v1/cases/MR05-b012-s104729/attempt-001/followup/runs/20261006T201550Z-7b668414f4/tools/iteration-0/price_stats.partitions.json",
  "plan_sha256": "7d2a658c839966a923f3544d2980b856d25b1b44978dcf70dd47efab3a1ecd84",
  "receipt_id": "20261006T201550Z-7b668414f4.0.price_stats",
  "result_path": "artifacts/campaigns/headline-live-v1/cases/MR05-b012-s104729/attempt-001/followup/runs/20261006T201550Z-7b668414f4/tools/iteration-0/price_stats.result.json",
  "result_sha256": "0ff423c36faef6a1560b6b58a598285b5475a241b0d9f2e78e9af277803c679c",
  "run_id": "20261006T201550Z-7b668414f4",
  "scan_complete": true,
  "schema_version": "1.0",
  "selection_sha256": "1ccdddd8b336cdcb847f12fcab3070437743de63698bbbde974963946f4d72fa",
  "source_snapshot_complete": true,
  "strategy": "indexed",
  "tool": "price_stats",
  "tool_version": "1.0",
  "unavailable_lookback_months": [
    "2024-08",
    "2024-09"
  ],
  "visible_months": [
    "2025-08",
    "2025-09",
    "2025-10",
    "2025-11",
    "2025-12",
    "2026-01",
    "2026-02",
    "2026-03",
    "2026-04",
    "2026-05",
    "2026-06",
    "2026-07"
  ]
}
