{
  "canonical_query_sha256": "b8495e2f40ed187c27a6dbea81889b9df240692710251bf019dbd1d97094f759",
  "dataset_view_sha256": "0a11b34903144216e4e7824e8c0395f55aad6d76727b5425728d41abe0b89420",
  "decision_sha256": "faa8f49b2adfca21c3f16f00da88e9e39149bbcc36f48adaf10fb3feb83ad6e9",
  "duration_ms": 11,
  "iteration": 1,
  "partition_receipts_path": "artifacts/reproductions/20261015T135745Z/cases/MR08-b020-s104729/attempt-001/followup/runs/20261015T155304Z-a388dfd336/tools/iteration-1/region_stats.partitions.json",
  "plan_sha256": "acb267afcec9a152355d5cf2c1824720bf2f1efdf3a0051fc597c6d16027683b",
  "receipt_id": "20261015T155304Z-a388dfd336.1.region_stats",
  "result_path": "artifacts/reproductions/20261015T135745Z/cases/MR08-b020-s104729/attempt-001/followup/runs/20261015T155304Z-a388dfd336/tools/iteration-1/region_stats.result.json",
  "result_sha256": "d22eaa4bd7216fd1d9e899e0b59df80668cb052971352ccb62458622b6e28d74",
  "run_id": "20261015T155304Z-a388dfd336",
  "scan_complete": true,
  "schema_version": "1.0",
  "selection_sha256": "83809e4350b9ff1632d4efe84c4c5088d4c81a174d9fd28c19c2e4b1b74e08a7",
  "source_snapshot_complete": true,
  "strategy": "full_csv",
  "tool": "region_stats",
  "tool_version": "1.0",
  "unavailable_lookback_months": [
    "2024-08",
    "2024-09"
  ],
  "visible_months": [
    "2025-08",
    "2025-09",
    "2025-10",
    "2025-11",
    "2025-12",
    "2026-01",
    "2026-02",
    "2026-03",
    "2026-04",
    "2026-05",
    "2026-06",
    "2026-07"
  ]
}
