{
  "canonical_query_sha256": "cc0eccc0f822802246d6dd59fb5dfec5c58215dfedff4d6fb8bf118da2f96e7f",
  "dataset_view_sha256": "bb0e9f3ed47a65eabbaab4e0a4de192ca7918a61eee111e273a70e145f87692b",
  "decision_sha256": "e21ad0bd656fe99187f52bc568d37989abf68bc3488b8ac5ba94892eb249992f",
  "duration_ms": 113,
  "iteration": 0,
  "partition_receipts_path": "artifacts/reproductions/20261015T135745Z/cases/MR05-b028-s104729/attempt-001/source/runs/20261015T153052Z-ce9a2033f2/tools/iteration-0/price_stats.partitions.json",
  "plan_sha256": "11db9f13751a1cc900da1067f73d8529cdab2feca12d11333318b2533f17f27c",
  "receipt_id": "20261015T153052Z-ce9a2033f2.0.price_stats",
  "result_path": "artifacts/reproductions/20261015T135745Z/cases/MR05-b028-s104729/attempt-001/source/runs/20261015T153052Z-ce9a2033f2/tools/iteration-0/price_stats.result.json",
  "result_sha256": "2358af1cb7056711d4a7103ee35cd73dbc8ab933f24d818bf5480853f36ef0d2",
  "run_id": "20261015T153052Z-ce9a2033f2",
  "scan_complete": true,
  "schema_version": "1.0",
  "selection_sha256": "4d15aae7700e8766ed6836e39a84fe85df2358a7cb6908ed952ceb2cb6f8424c",
  "source_snapshot_complete": true,
  "strategy": "indexed",
  "tool": "price_stats",
  "tool_version": "1.0",
  "unavailable_lookback_months": [
    "2024-09"
  ],
  "visible_months": [
    "2025-09",
    "2025-10",
    "2025-11",
    "2025-12",
    "2026-01",
    "2026-02",
    "2026-03",
    "2026-04",
    "2026-05",
    "2026-06",
    "2026-07",
    "2026-08"
  ]
}
