{
  "canonical_query_sha256": "ab81ddac9b19e16571cd3958f4af75be275b8bbf1e07bb79f02725439e1deeea",
  "dataset_view_sha256": "bb0e9f3ed47a65eabbaab4e0a4de192ca7918a61eee111e273a70e145f87692b",
  "decision_sha256": "eef637eaa8fe9902ae7a972a29e7c2acfa60bb0393270a370a666134ead22bf8",
  "duration_ms": 11,
  "iteration": 0,
  "partition_receipts_path": "artifacts/rca/MR05-b010-s104729/20261006T180443Z/runs/20261006T180443Z-21c31d1ec7/tools/iteration-0/supply_stats.partitions.json",
  "plan_sha256": "4bd5e62bf43f6a7b3bc1dc6ab99adb50c683c5fea2b51931b6ca56b5e411a819",
  "receipt_id": "20261006T180443Z-21c31d1ec7.0.supply_stats",
  "result_path": "artifacts/rca/MR05-b010-s104729/20261006T180443Z/runs/20261006T180443Z-21c31d1ec7/tools/iteration-0/supply_stats.result.json",
  "result_sha256": "26d83ee636839bb7921541c3e97a4222e6d6581b078cbce0771ec5958affc811",
  "run_id": "20261006T180443Z-21c31d1ec7",
  "scan_complete": true,
  "schema_version": "1.0",
  "selection_sha256": "c6cca365ab30f9521deccf35b44eb8713c21cd0bde551eb6761e498f506f3dde",
  "source_snapshot_complete": true,
  "strategy": "indexed",
  "tool": "supply_stats",
  "tool_version": "1.0",
  "unavailable_lookback_months": [
    "2024-07",
    "2024-08",
    "2024-09"
  ],
  "visible_months": [
    "2025-07",
    "2025-08",
    "2025-09",
    "2025-10",
    "2025-11",
    "2025-12",
    "2026-01",
    "2026-02",
    "2026-03",
    "2026-04",
    "2026-05",
    "2026-06"
  ]
}
