{
  "canonical_query_sha256": "dd03c47748c0d96f9fd12243b9ca99d4dec9a77cd582e6dadb15a82f2e8ed883",
  "dataset_view_sha256": "bb0e9f3ed47a65eabbaab4e0a4de192ca7918a61eee111e273a70e145f87692b",
  "decision_sha256": "e21ad0bd656fe99187f52bc568d37989abf68bc3488b8ac5ba94892eb249992f",
  "duration_ms": 113,
  "iteration": 0,
  "partition_receipts_path": "artifacts/reproductions/20261015T135745Z/cases/MR05-b018-s155921/attempt-001/source/runs/20261015T152848Z-265b56fa71/tools/iteration-0/price_stats.partitions.json",
  "plan_sha256": "947a4c9918b76fd75fffc74ac7e6d70d612266f1b086b29ed1a29e76ec6fa8d3",
  "receipt_id": "20261015T152848Z-265b56fa71.0.price_stats",
  "result_path": "artifacts/reproductions/20261015T135745Z/cases/MR05-b018-s155921/attempt-001/source/runs/20261015T152848Z-265b56fa71/tools/iteration-0/price_stats.result.json",
  "result_sha256": "6fe0f487503ff07332e57fefd178e4d21266f6efdaa9ced9acec877e69eeabce",
  "run_id": "20261015T152848Z-265b56fa71",
  "scan_complete": true,
  "schema_version": "1.0",
  "selection_sha256": "9f2f5c108525a0fc8e3e6ae93f799693625fc84229c9a8b66c00c9a2d4ac85ee",
  "source_snapshot_complete": true,
  "strategy": "indexed",
  "tool": "price_stats",
  "tool_version": "1.0",
  "unavailable_lookback_months": [
    "2024-08",
    "2024-09"
  ],
  "visible_months": [
    "2025-08",
    "2025-09",
    "2025-10",
    "2025-11",
    "2025-12",
    "2026-01",
    "2026-02",
    "2026-03",
    "2026-04",
    "2026-05",
    "2026-06",
    "2026-07"
  ]
}
