{
  "canonical_query_sha256": "cdc0a967e6afb872294101d6d1425e0e095a1c6c9c15f90c2bbe146d8f13d8c4",
  "dataset_view_sha256": "4a968398a324260ae41c44afb304d374beae91a34d2612ed0c9a92152f85f00f",
  "decision_sha256": "eef637eaa8fe9902ae7a972a29e7c2acfa60bb0393270a370a666134ead22bf8",
  "duration_ms": 45,
  "iteration": 0,
  "partition_receipts_path": "artifacts/campaigns/headline-live-v1/cases/MR03-b006-s130363/attempt-001/followup/runs/20261005T004918Z-39b530eb02/tools/iteration-0/supply_stats.partitions.json",
  "plan_sha256": "619011415942817876326d8fb552fff4171f4189e52b34c8b0874495ad42cd5c",
  "receipt_id": "20261005T004918Z-39b530eb02.0.supply_stats",
  "result_path": "artifacts/campaigns/headline-live-v1/cases/MR03-b006-s130363/attempt-001/followup/runs/20261005T004918Z-39b530eb02/tools/iteration-0/supply_stats.result.json",
  "result_sha256": "5a55bc2c01a3b26b21fffe6af811445a49896a49d3e29026641c4db9de618a19",
  "run_id": "20261005T004918Z-39b530eb02",
  "scan_complete": true,
  "schema_version": "1.0",
  "selection_sha256": "da8dce18874719a141ea360eeff1f7cb996ae9207ee93c53ca534d31e6085f4f",
  "source_snapshot_complete": true,
  "strategy": "indexed",
  "tool": "supply_stats",
  "tool_version": "1.0",
  "unavailable_lookback_months": [
    "2024-07",
    "2024-08",
    "2024-09"
  ],
  "visible_months": [
    "2025-07",
    "2025-08",
    "2025-09",
    "2025-10",
    "2025-11",
    "2025-12",
    "2026-01",
    "2026-02",
    "2026-03",
    "2026-04",
    "2026-05",
    "2026-06"
  ]
}
