{
  "canonical_query_sha256": "c187d5c76a2cfe14bbc5b3b38d5ef9c5ae58c2fdcd1aff1b7f04f30d8808c82b",
  "dataset_view_sha256": "c6bf692e67c60192e8d1d129acf93016ead7807f55b17429978bf731828c7c76",
  "decision_sha256": "eef637eaa8fe9902ae7a972a29e7c2acfa60bb0393270a370a666134ead22bf8",
  "duration_ms": 734,
  "iteration": 0,
  "partition_receipts_path": "artifacts/campaigns/headline-live-v1/cases/MR01-b015-s155921/attempt-001/followup/runs/20261003T001943Z-f1070811d0/tools/iteration-0/supply_stats.partitions.json",
  "plan_sha256": "023a32f050a5e9edfead4085773ba6616b983713a9e3bdd688f709820d8ba151",
  "receipt_id": "20261003T001943Z-f1070811d0.0.supply_stats",
  "result_path": "artifacts/campaigns/headline-live-v1/cases/MR01-b015-s155921/attempt-001/followup/runs/20261003T001943Z-f1070811d0/tools/iteration-0/supply_stats.result.json",
  "result_sha256": "a20c4ee605d7856c3995245e8555150abe0ab060b9d1c78edd64b54202a056a6",
  "run_id": "20261003T001943Z-f1070811d0",
  "scan_complete": true,
  "schema_version": "1.0",
  "selection_sha256": "15638ceeb910c983fe9ab9df038d1f56787f9af54d690e02450df88c6d963845",
  "source_snapshot_complete": true,
  "strategy": "indexed",
  "tool": "supply_stats",
  "tool_version": "1.0",
  "unavailable_lookback_months": [
    "2024-08",
    "2024-09"
  ],
  "visible_months": [
    "2025-08",
    "2025-09",
    "2025-10",
    "2025-11",
    "2025-12",
    "2026-01",
    "2026-02",
    "2026-03",
    "2026-04",
    "2026-05",
    "2026-06",
    "2026-07"
  ]
}
