{
  "canonical_query_sha256": "64004578a99d371fc8061a966f27ef3255f7162ee9cc5c797fd884b3db39b0d5",
  "dataset_view_sha256": "bb0e9f3ed47a65eabbaab4e0a4de192ca7918a61eee111e273a70e145f87692b",
  "decision_sha256": "edb3bfd5b5ce3f82b0abb93d5052890d0180e6c2520e4fb1df855367d33fde32",
  "duration_ms": 372,
  "iteration": 0,
  "partition_receipts_path": "artifacts/campaigns/headline-live-v1/cases/MR05-b005-s155921/attempt-001/source/runs/20261006T125204Z-78bcae73f4/tools/iteration-0/region_stats.partitions.json",
  "plan_sha256": "a2a2e77193cebcabfef80eb2d930ed60692497fc6b5a19864c105dd802d979e6",
  "receipt_id": "20261006T125204Z-78bcae73f4.0.region_stats",
  "result_path": "artifacts/campaigns/headline-live-v1/cases/MR05-b005-s155921/attempt-001/source/runs/20261006T125204Z-78bcae73f4/tools/iteration-0/region_stats.result.json",
  "result_sha256": "eea9b2bc0779774e15e4a6f3cd66bacce04a42b9a188afffb47d6192020baeec",
  "run_id": "20261006T125204Z-78bcae73f4",
  "scan_complete": true,
  "schema_version": "1.0",
  "selection_sha256": "289113ed8455fdbb0ea424365e163db5c75c697224efcbdd5b2c8d045d35766e",
  "source_snapshot_complete": true,
  "strategy": "indexed",
  "tool": "region_stats",
  "tool_version": "1.0",
  "unavailable_lookback_months": [
    "2024-07",
    "2024-08",
    "2024-09"
  ],
  "visible_months": [
    "2025-07",
    "2025-08",
    "2025-09",
    "2025-10",
    "2025-11",
    "2025-12",
    "2026-01",
    "2026-02",
    "2026-03",
    "2026-04",
    "2026-05",
    "2026-06"
  ]
}
