{
  "canonical_query_sha256": "884c9f59d021e71d987fdfe84f75228e0d52bfecdc6ae095d873e5a9ff34a2c1",
  "dataset_view_sha256": "bb0e9f3ed47a65eabbaab4e0a4de192ca7918a61eee111e273a70e145f87692b",
  "decision_sha256": "edb3bfd5b5ce3f82b0abb93d5052890d0180e6c2520e4fb1df855367d33fde32",
  "duration_ms": 485,
  "iteration": 0,
  "partition_receipts_path": "artifacts/reproductions/20261015T135745Z/cases/MR04-b017-s130363/attempt-001/followup/runs/20261015T152236Z-13f032a3f7/tools/iteration-0/region_stats.partitions.json",
  "plan_sha256": "560d9d4cacc3f1c54f858a13d0233650b1263b26c8afe48585510ee50442b308",
  "receipt_id": "20261015T152236Z-13f032a3f7.0.region_stats",
  "result_path": "artifacts/reproductions/20261015T135745Z/cases/MR04-b017-s130363/attempt-001/followup/runs/20261015T152236Z-13f032a3f7/tools/iteration-0/region_stats.result.json",
  "result_sha256": "80f7aa412f95d91d2eb5dc77f6ec0c63aad3ff289359e60c1c2bc61ee4e52500",
  "run_id": "20261015T152236Z-13f032a3f7",
  "scan_complete": true,
  "schema_version": "1.0",
  "selection_sha256": "6dd3a21ce8b1b1f5cf3691371cf0064b8ce1637613bc2b81bf5c97e4e6ae6e93",
  "source_snapshot_complete": true,
  "strategy": "indexed",
  "tool": "region_stats",
  "tool_version": "1.0",
  "unavailable_lookback_months": [
    "2024-08",
    "2024-09"
  ],
  "visible_months": [
    "2025-08",
    "2025-09",
    "2025-10",
    "2025-11",
    "2025-12",
    "2026-01",
    "2026-02",
    "2026-03",
    "2026-04",
    "2026-05",
    "2026-06",
    "2026-07"
  ]
}
