{
  "canonical_query_sha256": "11874c3d1000cc1bc39b764174a3da66fb8faa9e8d56bd157ce4b510ddba9490",
  "dataset_view_sha256": "0a11b34903144216e4e7824e8c0395f55aad6d76727b5425728d41abe0b89420",
  "decision_sha256": "eef637eaa8fe9902ae7a972a29e7c2acfa60bb0393270a370a666134ead22bf8",
  "duration_ms": 34,
  "iteration": 0,
  "partition_receipts_path": "artifacts/reproductions/20261015T135745Z/cases/MR08-b018-s104729/attempt-001/followup/runs/20261015T155134Z-03e4818044/tools/iteration-0/supply_stats.partitions.json",
  "plan_sha256": "534c3d7d7a39e8dfa5b271afe38f9a245a4872e11f0dae4dfa41f2df84956f85",
  "receipt_id": "20261015T155134Z-03e4818044.0.supply_stats",
  "result_path": "artifacts/reproductions/20261015T135745Z/cases/MR08-b018-s104729/attempt-001/followup/runs/20261015T155134Z-03e4818044/tools/iteration-0/supply_stats.result.json",
  "result_sha256": "a20c4ee605d7856c3995245e8555150abe0ab060b9d1c78edd64b54202a056a6",
  "run_id": "20261015T155134Z-03e4818044",
  "scan_complete": true,
  "schema_version": "1.0",
  "selection_sha256": "1ff313336a753eed58c508ea2a403875d79ae0147b8bec889cabaccfcb206199",
  "source_snapshot_complete": true,
  "strategy": "indexed",
  "tool": "supply_stats",
  "tool_version": "1.0",
  "unavailable_lookback_months": [
    "2024-08",
    "2024-09"
  ],
  "visible_months": [
    "2025-08",
    "2025-09",
    "2025-10",
    "2025-11",
    "2025-12",
    "2026-01",
    "2026-02",
    "2026-03",
    "2026-04",
    "2026-05",
    "2026-06",
    "2026-07"
  ]
}
