{
  "canonical_query_sha256": "f4e33aa9ac802188cf2e82e765447d8ffcbb15c352ff5abb8147179b6907863d",
  "dataset_view_sha256": "640ee18892e1c46b5158ab30477a6a884fae07deb0bd19bf64bcc4d40fdc4502",
  "decision_sha256": "eef637eaa8fe9902ae7a972a29e7c2acfa60bb0393270a370a666134ead22bf8",
  "duration_ms": 11,
  "iteration": 0,
  "partition_receipts_path": "artifacts/reproductions/20261015T135745Z/cases/MR02-b003-s104729/attempt-001/followup/runs/20261015T142054Z-f3b2c12442/tools/iteration-0/supply_stats.partitions.json",
  "plan_sha256": "6302c1d647cc6283f214dc2891938b1758c33ce9004dc6fdd6bd892030e78f2a",
  "receipt_id": "20261015T142054Z-f3b2c12442.0.supply_stats",
  "result_path": "artifacts/reproductions/20261015T135745Z/cases/MR02-b003-s104729/attempt-001/followup/runs/20261015T142054Z-f3b2c12442/tools/iteration-0/supply_stats.result.json",
  "result_sha256": "1d9ecdfe4659169633cadf3dd086ae15f3dd107310441efef7d53f6dd7731d7a",
  "run_id": "20261015T142054Z-f3b2c12442",
  "scan_complete": true,
  "schema_version": "1.0",
  "selection_sha256": "c4e80ea9182430f1d137937828bfd5874904704a439980fd1e7e23577ab71737",
  "source_snapshot_complete": true,
  "strategy": "indexed",
  "tool": "supply_stats",
  "tool_version": "1.0",
  "unavailable_lookback_months": [
    "2024-07",
    "2024-08",
    "2024-09"
  ],
  "visible_months": [
    "2025-07",
    "2025-08",
    "2025-09",
    "2025-10",
    "2025-11",
    "2025-12",
    "2026-01",
    "2026-02",
    "2026-03",
    "2026-04",
    "2026-05",
    "2026-06"
  ]
}
